<GameData Actions="4" Ego="20" xmlns:xsd="http://www.w3.org/2001/XMLSchema" xmlns:xsi="http://www.w3.org/2001/XMLSchema-instance" xsi:schemaLocation="http://www.w3schools.com XmlSchema.xsd">
	<Department Id="legal" Name="Legal" Accessible="true" UiPosX="911" UiPosY="429">
		<Fem Id="deborahJones" Name="Deborah Jones" Age="24" Ambition="90" Pride="100">
			<Trait Id="overAchiever" Name="Over-Achiever">
				<Effect AmbitionEffect=".5" />
			</Trait>
			<Interaction Id="insinuatingComments" Name="Insinuating Comments - No wonder you got this job, with an ass like that...  I may have to smack it one of these days." EgoCost="10">
				<InteractionResult>
					<DialogEntry IsPlayer="true" Dialog="No wonder you got this job, with an ass like that...  I may have to smack it one of these days."/>
					<DialogEntry IsPlayer="false" Dialog="Noooooo..."/>
					<Effect AmbitionEffect="-20"/>
				</InteractionResult>
				<InteractionResult>
					<DialogEntry IsPlayer="true" Dialog="Hey baby..."/>
					<DialogEntry IsPlayer="false" Dialog="Fuck you!"/>
					<Effect AmbitionEffect="5"/>
				</InteractionResult>
			</Interaction>
			<Interaction Id="takeControl" Name="Take Control" RequiredAmbition="0">
				<InteractionResult>
					<DialogEntry IsPlayer="true" Dialog="I own you now."/>
					<DialogEntry IsPlayer="false" Dialog="OK Sempai..."/>
					<Effect EgoEffect="100" ControlEffect="true"/>
				</InteractionResult>
			</Interaction>
			<Interaction Id="motivationRoomApt" Name="Motivation Room Appointment" EgoCost="20" TurnCost="4" RequiredControl="true" RequiredPolicies="peaceOfMind">
				<InteractionResult>
					<DialogEntry IsPlayer="true" Dialog="I think your attitude needs correcting..."/>
					<DialogEntry IsPlayer="false" Dialog="Oh no!  Please don't spank me sir!"/>
					<Effect PrideEffect="-20"/>
				</InteractionResult>
			</Interaction>
		</Fem>
		<Policy Id="peaceOfMind" Name="Peace of Mind" Active="false"/>
	</Department>
</GameData>